33.7174708,-117.83,Convergent 35 MW / 140 MWh - SCE,United States,140000,35000,4,140000
36.6783938,-119.9277947,20 MW / 80 MWh - Energy Nuevo - Amber Kinetics,United States,80000,20000,4,80000
48.2359399,-114.28,Flathead Electric ViZn Z20,United States,160,80,2,160
41.3308666,-88.71,Grand Ridge Energy Storage 31.5 MW,United States,11970,31500,0.38,11970
41.3308666,-88.71,Invenergy Grand Ridge Wind Project BESS,United States,11970,31500,0.38,11970
33.5965685,-117.659405,Franchise Services - JLM Energy,United States,120,60,2,120
37.3586027,-122.0671533,MVLA High School District - Mountain View HS,United States,400,200,2,400
33.12,-117.09,Olivenhain-Hodges Storage Project,United States,240000,40000,6,240000
30.0689883,-89.8031821,Entergy Chef Menteur Highway 500 kW Energy Storage,United States,500,500,1,500
47.6739881,-122.12,Clean Energy Storage: Sun Buzz,United States,25,5,5,25
39.3685167,-107.04,Rocky Mountain Institute Innovation Center,United States,45,30,1.5,45
35.29315669,-81.02474807,Duke Energy Rankin Substation - Win Inertia / Aquion Energy,United States,300,50,6,300
35.29315669,-81.02474807,Duke Energy Rankin Substation - Win Inertia / Maxwell,United States,75,250,0.3,75
37.71782845,-121.8879894,Santa Rita Jail Smart Grid - Alameda County RDSI CERTS Microgrid Demonstration,United States,4000,2000,2,4000
39.98689012,-75.13004339,SEPTA Recycled Energy and Optimization Project - Viridity Energy,United States,400,800,0.5,400
40.7481266,-74.01,Schooner America 2.0 Electric Populsion,United States,625,250,2.5,625
40.4776121,-75.77,East Penn Manufacturing Co. Grid-Scale Energy Storage Demonstration,United States,2160,3000,0.72,2160
41.910738,-83.43,Community Energy Storage for Grid Support (Residential CES Units) - DTE Energy,United States,1000,500,2,1000
40.5813072,-122.3776083,Ice Energy Project at 1540 Charles Dr Ste B,United States,60,10,6,60
40.017107,-75.084547,SEPTA Wayside Energy Storage System - Viridity Energy,United States,450,900,0.5,450
40.017107,-75.084547,SEPTA Wayside Energy Storage System - Griscom Ultracapacitors,United States,49,70,0.7,49
35.2272086,-80.8430827,McAlpine Circuit CES System,United States,50,50,1,50
39.7566228,-104.62,Xcel Energy - Xtreme Power,United States,1005,1500,0.67,1005
31.8072113,-106.43,Fort Bliss Microgrid - Lockheed Martin,United States,99,300,0.33,99
34.0005691,-118.16,Net Zero Plus Electric Training Institute (NZP-ETI) - Solar Plus Storage,United States,250,500,0.5,250
42.508645,-83.41,Nissan Technical Center North America,United States,22800,1425,16,22800
40.56610748,-122.368486,Ice Energy project at 280 Hartnell Ave,United States,120,20,6,120
40.54787428,-122.3792334,Ice Energy project at 2680 Radio Ln,United States,1020,170,6,1020
38.5743919,-121.5081799,SMUD 2500 R St. Housing Development,United States,394.74,153,2.58,394.74
28.59899755,-81.19712501,University of Central Florida - DN Tanks,United States,24000,3000,8,24000
20.6871749,-156.4390415,"University of Hawaii Smart Grid Regional and Energy Storage Demonstration Project (Maui Smart Grid) - Maui Electric Company & NEC Energy Solutions, Inc.",United States,1000,1000,1,1000
46.7270506,-117.1467957,Washington State University 1 MW UET Flow Battery - Avista Utilities,United States,3200,1000,3.2,3200
34.087225,-118.2918217,Los Angeles Community College District - Calmac,United States,27720,4620,6,27720
35.87576905,-106.3110716,Japan-US Collaborative Smart Grid Project,United States,6000,1000,6,6000
34.0398353,-85.2227791,"1 MW / 2 MWh - EPRI + Southern Company Pilot BESS - Cedartown, Georgia",United States,2000,1000,2,2000
40.57787115,-122.3542245,Ice Energy project at 2010 Churn Creek Rd,United States,120,20,6,120
40.61151949,-122.3822139,Ice Energy project at 100 Lake Blvd,United States,120,20,6,120
33.65068625,-117.7497199,20 Pacifica Irvine Co - AMS Hybrid-Electric Building,United States,1500,250,6,1500
21.2920698,-157.846227,Nordstrom (Ala Moana Center) - Calmac,United States,7200,1200,6,7200
38.05237612,-122.1525948,Geli EOS enabled CODA Core System (City of Benicia City Hall),United States,40,20,2,40
34.1908099,-119.16,Gills Onions - Prudent Energy VRB-ESS,United States,3600,600,6,3600
64.8377778,-147.72,Golden Valley Electric Association (GVEA) Battery Energy Storage System (BESS),United States,6750,27000,0.25,6750
34.0945216,-117.5721771,"20 kW / 72 kWh ICL Fire Retardant Production Site - Rancho Cucamonga, CA",United States,72,20,3.6,72
34.1424258,-118.0008149,CODA Energy - CORE 40/30,United States,39.9,30,1.33,39.9
37.30620385,-121.7519767,Yerba Buena Battery Energy Storage Pilot Project - Pacific Gas & Electric Company,United States,28000,4000,7,28000
39.71369071,-86.18708871,IPL Advancion Energy Storage Array,United States,20000,20000,1,20000
40.261109,-82.83,RES Battery Utility of Ohio,United States,2600,4000,0.65,2600
33.7513419,-117.99,SCE LESTA: 2 MW A123 Test,United States,500,2000,0.25,500
20.7909697,-156.33,Auwahi Wind Farm,United States,27500,11000,2.5,27500
33.0959158,-117.1035102,Del Lago Academy (IES),United States,200,100,2,200
33.1216125,-117.3185793,Carlsbad 7-Eleven Green Charge Networks Greenstation,United States,30,30,1,30
37.6818745,-121.77,Golden Hills - NextEra Energy,United States,60000,30000,2,60000
42.3039993,-88.4,McHenry Battery Storage Project - EDF Renewable Energy,United States,46600,20000,2.33,46600
29.65153375,-82.32156145,Alachua County Library,United States,900,100,9,900
33.5369476,-117.0517789,Ponte Winery - Ice Energy,United States,360,60,6,360
40.573999,-122.373735,Tortilla Flats Restaurant - Ice Energy,United States,120,20,6,120
40.62652188,-122.3842207,Skyway Recreation Products - Ice Energy,United States,120,20,6,120
31.7509852,-106.3652665,EPCC Thermal Storage: Valle Verde,United States,7440,930,8,7440
38.2930864,-122.457675,Stone Edge Farm Winery- All Iron Flow Battery (IFB),United States,60,10,6,60
33.5934104,-102.03,Technology Solutions for Wind Integration - Center For Commercialization of Electric Technology (CCET),United States,1000,1000,1,1000
43.15076665,-89.29613801,Alliant Energy - Solar Demonstration Project,United States,30,30,1,30
41.9165863,-83.46907334,Monroe Community College CES Unit for Grid Support - DTE Energy,United States,250,500,0.5,250
34.1291051,-117.8891239,Ice Energy project at 901 E Alosta Ave,United States,720,120,6,720
34.1344841,-117.8970195,Ice Energy project at 701 E. Foothill Blvd,United States,720,120,6,720
21.9661076,-159.57,Kaua'i Dispatchable Solar Storage - 13 MW / 52MWh  - SolarCity,United States,52000,13000,4,52000
34.4480495,-119.242889,Taft Botanical Gardens - SimpliPhi Power,United States,40,10,4,40
37.526323,-120.8,EnerVault Redox Flow Battery Demo Project,United States,1000,250,4,1000
33.78659,-117.88,SCE Distributed Energy Storage Integration (DESI) Pilot 1,United States,3888,2400,1.62,3888
33.97983212,-118.1429253,PDE Smart Microgrid System,United States,29.7,90,0.33,29.7
40.9999202,-80.3471856,"Axion PowerCube for PJM (New Castle, PA)",United States,250,500,0.5,250
34.2204227,-118.3878945,Airbnb and kitHAUS Microgrid Pop Up House,United States,5,5,1,5
37.7949618,-122.2627932,Laney College Green Charge Networks GreenStation,United States,30,30,1,30
37.78986994,-122.1684513,Merritt College Green Charge Networks GreenStation,United States,30,30,1,30
37.7936847,-122.2612767,Peralta College Green Charge Networks GreenStation,United States,30,30,1,30
34.69814135,-118.1418401,Lancaster MOAH Green Charge Networks Greenstation,United States,30,30,1,30
33.1192068,-117.09,Escondido Energy Storage,United States,120000,30000,4,120000
40.6085255,-122.3782915,Redding Furniture and Mattress - Ice Energy,United States,240,40,6,240
40.51295786,-105.0198541,Fossil Ridge High School,United States,1600,200,8,1600
39.8440027,-75.02,CrystEna 1 MW Energy Storage System- Demansys Energy Inc.,United States,450,1000,0.45,450
33.936265,-117.18646,Ice Energy project at 27200 Eucalyptus Ave,United States,120,20,6,120
38.2830361,-104.5345853,Pueblo Air Cooled Run Test Facility - Calmac,United States,14068,3517,4,14068
38.2830361,-104.5345853,Pueblo West Factory Building - Calmac,United States,14068,3517,4,14068
47.9366554,-122.2439622,Everett MESA 1b Project - SNOPUD,United States,500,1000,0.5,500
38.27134251,-122.4385839,Stone Edge Farm Winery - Aquion Energy,United States,350.1,30,11.67,350.1
38.3498195,-81.63,Charleston NaS Energy Storage Project - AEP,United States,7200,1200,6,7200
29.95213155,-90.07729185,New Orleans City Hall - PosiGen / SimpliPhi Power,United States,20,10,2,20
46.8385968,-92.08302584,Hartley Nature Center,United States,14.22,6,2.37,14.22
40.57651929,-122.3577323,Ice Energy project at 2143 Hilltop Dr,United States,120,20,6,120
40.5813072,-122.3776083,Ice Energy project at 2155 Hilltop Dr Ste A,United States,60,10,6,60
40.57673492,-122.3577268,Ice Energy project at 2131 Hilltop Dr,United States,60,10,6,60
37.6390972,-120.9968782,Modesto Irrigation District - Primus Power,United States,112000,28000,4,112000
43.8006208,-70.19,Nextera Wyman,United States,8100,16200,0.5,8100
33.1192068,-117.09,Escondido School District-Tesla,United States,630,150,4.2,630
37.5482697,-121.99,SolarCity / Tesla / Princeton Power EV Charging Station (Fremont Site 2),United States,30,30,1,30
44.440095,-73.15234,Dynapower Company HQ micro-grid,United States,251.25,375,0.67,251.25
38,-121.4,"8 MWh Con Edison & GE - Central Valley, CA",United States,8000,2000,4,8000
48.76504271,-114.2890395,Polebridge Mercantile & Cabins,United States,44,22,2,44
33.2464523,-119.5,San Nicolas Island Naval Facility - EnSync Energy (formerly ZBB),United States,1000,500,2,1000
39.0300191,-77.46964647,VISA (Data Processing Center),United States,50,25,2,50
35.6507888,-117.66173,China Lake Microgrid,United States,800,200,4,800
38.65075258,-121.1226436,Wholefood Signage System,United States,25,1,25,25
43.1915361,-77.6612012,Arista Durathon Battery Project,United States,200,100,2,200
47.8887886,-122.29,UET HQ Mukilteo BESS,United States,1800,600,3,1800
39.7546349,-105.2205809,"US NORTHCOM BESS project - Erigo Technologies, EaglePicher Technologies",United States,384,300,1.28,384
21.304547,-157.855676,Joint Base Pearl Harbor Hickam (JBPHH) U.S. Military Base,United States,416.25,125,3.33,416.25
40.14976132,-88.27290628,EnerDel Mobile Hybrid Power System,United States,79.95,15,5.33,79.95
21.42849845,-158.0161857,Ensync Distributed Energy Management: Aquion,United States,87.5,25,3.5,87.5
20.74886268,-156.4456087,RDT&E for Advanced Energy Storage & Management Demonstration for USAF High Energy Demand Operations and Facilities,United States,200,100,2,200
38.4497134,-123.12,Aquion AHI at Redwood Gate Ranch,United States,60,15,4,60
21.4508308,-158.0095783,Mari's Gardens Aquion Energy,United States,20,10,2,20
34.6809319,-98.57088468,Fort Sill Microgrid - EnSync (Formerly ZBB),United States,500,250,2,500
33.5080818,-86.79,JLM Energy: Alabama Solar-tied,United States,300,300,1,300
33.4483771,-112.07,PV and EV Charging Systems at Sporting Venue,United States,50,25,2,50
37.82672135,-122.422759,Alcatraz Island Microgrid,United States,1900,400,4.75,1900
40.6955044,-74.23,Bysolar Hillside ESS for PJM Frequency Regulation,United States,500,500,1,500
38.8737066,-76.9957732,DC Naval Yard Zero Energy Building,United States,48,16,3,48
32.8776555,-117.2432723,UC San Diego ZBB / SunPower Energy Storage,United States,300,100,3,300
46.8591287,-88.7774734,National Park Service Isle Royale,United States,200,100,2,200
37.771671,-122.401621,Adobe Baker and Hamilton Building Stem System,United States,181.44,162,1.12,181.44
34.39,-117.4,Clean Energy Storage: Golden Bridge Development,United States,15,5,3,15
37.931868,-121.7,Clean Energy Storage: Berkes,United States,77,11,7,77
36.988562,-121.81,Clean Energy Storage: Dibene,United States,192,24,8,192
41.83429985,-87.62926175,Illinois Institute of Technology RDSI Perfect Power Demonstration - EnSync Energy (formerly ZBB),United States,500,250,2,500
34.058061,-117.471388,Cox Enterprises Stem PowerStore System,United States,18,18,1,18
33.5701909,-117.7264075,Green Charge Networks Greenstation (Aliso Viejo Site 1),United States,30,30,1,30
47.9789848,-122.2,Clean Energy Storage: Nagasawa,United States,25,5,5,25
40.74438495,-73.95730377,Rose City Lights,United States,900,225,4,900
20.74962204,-156.4402813,Maui Brewing Company Microgrid,United States,90.93,21,4.33,90.93
46.716439,-122.960801,Clean Energy Storage: Centralia College,United States,40,5,8,40
47.6062095,-122.33,Clean Energy Storage: Steel Project,United States,20,5,4,20
47.6062095,-122.33,Clean Energy Storage: Devinenini,United States,20,5,4,20
41.2331116,-80.49,Axion Power International-Sharon-12.5 MW,United States,12500,12500,1,12500
38.7733961,-75.1379574,"Lewes BPW / Alevo - 8 MW - (Lewes, Delaware)",United States,4000,8000,0.5,4000
32.7783843,-116.99,Grossmont Union High School District,United States,7400,1850,4,7400
39.158168,-75.52,Sunvault Energy-Edison Power- Delaware Fire Station,United States,300,600,0.5,300
32.8776555,-117.2432723,UCSD SGIP PV Projects,United States,365,730,0.5,365
40.6804279,-122.37,GE and Con Edison 8 MWh,United States,8000,2000,4,8000
37.6688205,-122.08,Seeo Inc. Solid State Batteries for Grid-Scale Energy Storage,United States,25,100,0.25,25
39.4453393,-83.83,Clinton County BESS - Exelon / RES,United States,250000,10000,25,250000
41.9837014,-87.6527002,Shedd Aquarium-1MW lithium-ion battery,United States,280,1000,0.28,280
32.8776555,-117.2432723,UCSD MCV 35 kW,United States,35,35,1,35
32.8776555,-117.2432723,UCSD Sunverge 10 kW,United States,10,10,1,10
35.8880796,-106.31,NEDO New Mexico Smart Grid Demonstration Project,United States,800,800,1,800
37.5629917,-122.33,SolarCity Walmart Solar Storage Projects California,United States,400,200,2,400
41.6032207,-73.09,Connecticut Municipal Electric Energy Cooperative (CMEEC) - SolarCity / Brightfields Development,United States,6000,1500,4,6000
33.96746255,-117.6759192,Inland Empire Utilities Agency (IEUA) - AMS,United States,8000,4000,2,8000
37.487561,-122.226784,Redwood City Parking Garage Green Charge Networks Greenstation,United States,30,30,1,30
33.91737514,-118.0901529,Green Charge Networks Greenstation (Norwalk Site 1),United States,30,30,1,30
32.816833,-117.155183,Green Charge Networks Greenstation (San Diego Site 1),United States,30,30,1,30
32.80603145,-117.2187434,Green Charge Networks Greenstation (San Diego Site 2),United States,30,30,1,30
40.9514874,-73.8879132,Green Charge Networks (Yonkers Site 1),United States,96,96,1,96
42.2486332,-88.61,Marengo Project,United States,5000,20000,0.25,5000
41.272,-73.778,New York's First Completed Solar Energy Storage Project,United States,1960,490,4,1960
30.6332618,-97.68,Rabbit Hill Energy Storage Project,United States,5000,10000,0.5,5000
30.6332618,-97.68,Rabbit Hill Energy Storage Project,United States,12276,9900,1.24,12276
44.36107816,-73.0741812,Hinesburg Energy Storage System,United States,5000,2000,2.5,5000
40.110048,-74.497357,Plumsted Energy Storage,United States,20000,20000,1,20000
40.660985,-75.136857,Stryker Energy Storage,United States,20000,20000,1,20000
39.38177,-74.44907,Atlantic County Utility Authority,United States,1000,1000,1,1000
39.3995008,-84.56,Willey Energy Storage Project,United States,40000,10000,4,40000
33.9760102,-118.4181654,Green Charge Networks Greenstation (Playa Vista Site 1),United States,30,30,1,30
39.7817213,-89.65,Comed-Bronzeville-Demo,United States,2000,1000,2,2000
59.8771655,-163.1495591,Kwigillingok Wind-Diesel Battery Hybrid,United States,62.5,250,0.25,62.5
66.8983333,-162.6,Kotzebue Electric Association - Saft,United States,945,2100,0.45,945
40.7127281,-74.0060152,Con Edison/Eos Energy Storage Distributed Energy Storage Pilot,United States,6000,1000,6,6000
29.9510658,-90.07,Entergy Solar-Plus-Storage Pilot Project,United States,500,1000,0.5,500
38.6779591,-121.18,3 MW - PG&E Clarksville Substation- Western Grid,United States,6000,3000,2,6000
34.0805651,-118.07,SCE Home Battery Pilot,United States,200,80,2.5,200
33.9022367,-118.08,SCE LM6000 Hybrid EGT - Center,United States,4200,10000,0.42,4200
33.6387024,-117.84,SCE Irvine Smart Grid Demonstration: CES,United States,50,25,2,50
33.6839473,-117.79,SCE Irvine Smart Grid Demonstration: Solar Car Charging Station,United States,100,100,1,100
33.7383271,-117.8930441,Discovery Science Center Durathon Battery,United States,500,100,5,500
39.978371,-86.12,Clay Terrace Plug-In Ecosystem,United States,50.25,75,0.67,50.25
47.6144219,-122.192337,PSE Storage Innovation Project 2,United States,4400,2000,2.2,4400
39.9650746,-83.00544185,AEP Ohio gridSMART Demonstration Project,United States,100,100,1,100
30.3952976,-97.74,Pecan Street Project Inc. Energy Internet Demonstration,United States,37.5,15,2.5,37.5
39.3995008,-84.56,Willey Energy Storage Project,United States,1980,6000,0.33,1980
33.5016932,-117.6625509,"SDGE C1243 Ortega HWY, GRC ES Program Unit 6",United States,3000,1000,3,3000
32.799466,-116.9510045,"SDGE C75 Mt San Miguel, GRC ES Program Unit 7",United States,3000,1000,3,3000
36.6783938,-119.93,1 MW - PG&E Old Kearney Substation - Hecate Energy,United States,2000,1000,2,2000
39.258289,-123.22,PG&E Mendocino Substation 1 MW Energy Storage System - Hecate Energy,United States,2000,1000,2,2000
33.2566792,-116.3782682,"SDGE Borrego SES, GRC ES Program Unit 5",United States,3000,1000,3,3000
33.3426566,-118.318384,SCE Catalina Island Energy Storage,United States,7200,1000,7.2,7200
33.2558717,-116.38,Borrego Springs Microgrid - SDG&E,United States,1500,500,3,1500
30.1200111,-95.37,Discovery at Spring Trails Residential Energy Storage,United States,420,30,14,420
36.80287166,-119.8623862,Green Charge Networks GreenStation Announced 5,United States,180,180,1,180
36.82385166,-119.6976737,Green Charge Networks GreenStation Announced 7,United States,60,60,1,60
36.8641913,-119.6390578,Green Charge Networks GreenStation Announced 8,United States,60,60,1,60
36.85930408,-119.7630251,Green Charge Networks GreenStation Announced 11,United States,60,60,1,60
36.81649333,-119.808477,Green Charge Networks GreenStation Announced 1,United States,120,120,1,120
36.7212902,-119.8060144,Green Charge Networks GreenStation Announced 2,United States,60,60,1,60
36.76620637,-119.8042239,Green Charge Networks GreenStation Announced 3,United States,60,60,1,60
36.8563985,-119.7751667,Green Charge Networks GreenStation Announced 4,United States,60,60,1,60
32.75339358,-117.1300642,Green Charge Networks GreenStation Announced 19,United States,120,60,2,120
33.0209308,-117.0722018,Green Charge Networks GreenStation Announced 20,United States,120,60,2,120
32.80863372,-117.1159837,Green Charge Networks GreenStation Announced 21,United States,120,60,2,120
32.9941333,-117.2544345,Green Charge Networks GreenStation Announced 24,United States,120,60,2,120
32.71854665,-117.1695199,Green Charge Networks GreenStation Announced 33,United States,60,30,2,60
32.82917201,-117.1327609,Green Charge Networks GreenStation Announced 34,United States,120,60,2,120
32.7157969,-117.1693572,Green Charge Networks GreenStation Announced 18,United States,180,90,2,180
33.9863913,-117.5227325,Green Charge Networks GreenStation Announced 22,United States,60,30,2,60
34.1883735,-119.2220629,Green Charge Networks GreenStation Announced 23,United States,60,30,2,60
36.9886992,-121.9550714,Green Charge Networks GreenStation Announced 25,United States,60,30,2,60
34.0183853,-118.0338542,Green Charge Networks GreenStation Announced 26,United States,400,200,2,400
33.7415456,-117.031222,Green Charge Networks GreenStation Announced 27,United States,120,60,2,120
34.0990733,-118.1085682,Green Charge Networks GreenStation Announced 28,United States,120,60,2,120
33.67334875,-117.9560726,Green Charge Networks GreenStation Announced 29,United States,180,90,2,180
34.0574169,-117.1733065,Green Charge Networks GreenStation Announced 30,United States,800,400,2,800
37.4922157,-122.22432,Green Charge Networks GreenStation Announced 31,United States,180,90,2,180
36.8644602,-119.7112081,Green Charge Networks GreenStation Announced 6,United States,400,200,2,400
36.81720479,-119.6820585,Green Charge Networks GreenStation Announced 9,United States,400,200,2,400
36.8916092,-119.7340863,Green Charge Networks GreenStation Announced 10,United States,400,200,2,400
37.723561,-122.400192,Green Charge Networks GreenStation Announced 13,United States,2000,1000,2,2000
33.975344,-118.034833,Green Charge Networks GreenStation Announced 14,United States,120,60,2,120
34.2782985,-119.2281025,Green Charge Networks GreenStation Announced 15,United States,400,200,2,400
34.163043,-119.159316,Green Charge Networks GreenStation Announced 16,United States,400,200,2,400
34.2848669,-118.8778891,Green Charge Networks GreenStation Announced 17,United States,800,400,2,800
34.425207,-119.703244,County of Santa Barbara Green Charge Networks GreenStation,United States,30,30,1,30
34.584807,-120.1441616,California Fresh Market Green Charge Networks GreenStation,United States,30,30,1,30
38.00466675,-122.5551134,Kaiser Permanente San Rafael Green Charge Networks GreenStation,United States,30,30,1,30
36.97879656,-122.0208881,90 kW / 180 kWh Santa Cruz County Building - Green Charge Networks,United States,180,90,2,180
34.1726298,-118.76,Oak Park USD - Brookside Elementary School Green Charge Networks GreenStation,United States,120,60,2,120
37.385071,-122.109264,MVLA High School District - Los Altos HS,United States,400,200,2,400
34.0125238,-118.4956258,Shore Hotel Green Charge Networks GreenStation,United States,60,60,1,60
33.67122986,-117.8452182,Park Place LBA Realty - Stem,United States,3000,1500,2,3000
33.4936391,-117.15,Temecula Valley Unified School District - SolarCity,United States,2600,260,10,2600
21.3236186,-157.88,36 kW Watanabe Floral Project,United States,72,36,2,72
37.6390972,-120.9968782,Modesto Irrigation District - Primus Power,United States,112000,28000,4,112000
37.6390972,-120.9968782,MID Primus Power Wind Energy Storage Demonstration - Renewables Firming,United States,1000,250,4,1000
32.8246632,-117.1520148,"SDGE Skills CES, GRC ES Program Unit 2",United States,50,25,2,50
32.9628234,-117.0358646,"SDGE Poway CES, GRC ES Program Unit 4",United States,50,25,2,50
32.8246632,-117.1520148,"SDGE Clairmont CES, GRC ES Program Unit 3",United States,50,25,2,50
36.14433798,-115.228048,Nevada Energy Battery Storage Project (Villa Trieste),United States,10,5,2,10
36.1672559,-115.148516,UNLV RDSI Demonstration Project,United States,8.55,9,0.95,8.55
35.2272086,-80.8430827,Duke Energy- Residential,United States,10.98,6,1.83,10.98
21.304547,-157.855676,HECO/Greensmith Energy Battery Energy Storage System,United States,20,5,4,20
46.35014,-94.22,Brainerd Public Utilities Battery Pilot,United States,10,5,2,10
46.2087066,-119.1199192,Benton PUD Battery Energy Storage,United States,40,10,4,40
43.6831948,-92.9698262,Austin Utilities Energy Storage Pilot,United States,74,37,2,74
44.60446765,-75.18627634,Ultralife SUNY Canton Wind Integration Demo,United States,2000,500,4,2000
42.112485,-75.98,AES Johnson City,United States,2000,8000,0.25,2000
41.5964825,-73.91,NYSERDA-EOS Microgrid,United States,1075,250,4.3,1075
33.1580933,-117.35,NRG Energy 0.5 MW,United States,2000,500,4,2000
36.527,-114.761,Southern Bighorn Solar &amp; Storage Center - 300 Megawatt Solar Array,United States,1200,300,4,1200
38.42547616,-122.8320976,10 MW - PG&E Molino Substation- Hecate Energy,United States,20000,10000,2,20000
41.72742028,-81.25447908,City of Painesville Municipal Power Vanadium Redox Battery Demonstration,United States,8640,1080,8,8640
40.70446735,-74.01263158,American Vanadium Corp. MTA CellCube Installation,United States,389.7,90,4.33,389.7
40.7830603,-73.97,New York City 1 MW Aggregated BTM - Glenwood Management,United States,4000,1000,4,4000
33.6588951,-117.83,Irvine Ranch Water District (IRWD) - AMS,United States,47.95,7,6.85,47.95
33.69125877,-117.8333905,Grand Johanna Aliso Canyon Energy Storage - SCE / Powin,United States,8000,2000,4,8000
33.7700504,-118.19,AES Alamitos Energy Storage Array,United States,400000,100000,4,400000
34.0321056,-117.5585169,Aliso Canyon SCE Mira Loma Substation - Tesla,United States,80000,20000,4,80000
33.1192068,-117.09,SDG&E Escondido Substation - AES,United States,120000,30000,4,120000
32.7947731,-116.96,SDG&E El Cajon Substation - AES,United States,30000,7500,4,30000
47.5877433,-122.24,Clean Energy Storage: Advanced Energy Storage Research & Innovation Center,United States,360,30,12,360
34.35779262,-119.054719,Santa Paula 1 - Western Grid Development LLC,United States,20000,5000,4,20000
34.05858449,-117.7785179,AltaGas Pomona Energy - SCE / Greensmith Energy,United States,80000,20000,4,80000
39.0817985,-77.1516844,TimberRock De-MAP Test,United States,10,10,1,10
37.1619755,-94.3143336,Carthage Water & Electric Plant,United States,227,100,2.27,227
39.04124864,-94.57052543,Kansas City Green Impact Zone SmartGrid - Kansas City Power and Light,United States,1000,1000,1,1000
37.680208,-121.79,Livermore Valley Performing Arts Center 30 kW Imergy Flow Battery,United States,120,30,4,120
37.5482697,-121.99,SolarCity / Tesla / Princeton Power Grid Services Project (Fremont Site 1),United States,200,200,1,200
41.256483,-74.3598755,Rural New York Smart Home - Lotus Energy / SimpliPhi,United States,163.4,20,8.17,163.4
20.8029568,-156.3106833,Juicebox Energy-Rising Sun Solar- Maui,United States,8,4,2,8
37.71274725,-121.7971744,Las Positas College EPIC Microgrid - Imergy / GELI,United States,1000,250,4,1000
38.92327342,-94.65810844,Black & Veatch World Headquarters Microgrid System,United States,300,200,1.5,300
42.2042586,-72.62,Holyoke Resiliency Facilities (MASS DOER Community Resiliency),United States,1966,983,2,1966
42.58616265,-70.91706881,Beverly Regional Cache Site (MASS DOER Community Resiliency),United States,78,39,2,78
32.7766642,-96.8,Oncor Battery Storage,United States,750,250,3,750
40.7127837,-74.01,Queens College-CUNY PV System,United States,240,60,4,240
