42.6583356,-71.14,Schneider Electric-Boston One,United States,1000,400,2.5,1000
21.1443935,-157.02,6 MW / 10 MWh Molokai Island Energy - Phase One,United States,10020,6000,1.67,10020
33.162252,-117.347564,Ocean Park Inn 18 kW Stem,United States,18,18,1,18
38.24006457,-122.285172,2 MWh - Napa Sanitation District - Tesla,United States,2000,500,4,2000
41.67645081,-70.19550374,Dennis-Yarmouth High School Regional Shelter (MASS DOER Community Resiliency),United States,512,512,1,512
40.9634335,-72.18,Long Island Community Microgrid Project - 5 MW / 25 MWh,United States,25000,5000,5,25000
42.6065743,-72.6,Greenfield High School (MASS DOER Community Resiliency),United States,258,129,2,258
44.126857,-70.8918,Charlotte Hobbs Memorial Library - JuiceBox Energy,United States,10.38,6,1.73,10.38
35.130454,-79.367756,Bosch Fort Bragg,United States,100,100,1,100
40.6781784,-73.94,Con Edison Virtual Power Plant - SunPower / Sunverge,United States,3996,1800,2.22,3996
48.8901226,-121.95,2 MW/ 4.4 MWh Puget Sound Energy - Glacier Battery Storage,United States,4400,2000,2.2,4400
43.3595096,-115.4501724,Cat Creek Energy & Water Storage Renewable Power Station,United States,87120000,720000,121,87120000
32.9179,-116.9264,San Vicente Pumped Storage,United States,4000000,500000,8,4000000
41.665573,-112.435667,"Promontory Microgrid CAES - ATK Launch Systems - Over 540 Buildings on a Sprawling 19,900-Acre Site",United States,60,80,0.75,60
33.6680772,-117.33,Lake Elsinore Advanced Pumped Storage,United States,6000000,500000,12,6000000
32.87935255,-117.2311005,UCSD Amber Kinetics 40 kWh Flywheel,United States,15.5,25,0.62,15.5
31.8354447,-95.8388504,Bethel Energy Center - Apex Compressed Air Energy Storage - 317 MW Compressed Air Energy Storage,United States,30432000,317000,96,30432000
61.2180556,-149.9002778,Chugach Electric Association Microgrid Hybrid Storage - 2MW,United States,500,2000,0.25,500
61.166488,-149.910702,Chugach Multi-Stage Energy Storage System (MS-ESS) - 320 kW,United States,256,320,0.8,256
21.4389123,-158.0000565,Campbell Industrial Park 8kW / 32kWh Flywheel ESS - Amber Kinetics &amp; Hawaiian Electric Company,United States,32,8,4,32
41.8023171,-107.24,Black Canyon Pumped Storage,United States,11000000,1000000,11,11000000
38.4343464,-118.49,Rose Creek Pumped Storage,United States,3000000,250000,12,3000000
43.3595407,-115.4497699,Anderson Pumped Storage,United States,960000,80000,12,960000
39.356,-114.799,White Pine Pumped Storage,United States,9000000,750000,12,9000000
44.0978126,-120.1,Prineville Pumped Storage,United States,1230000,150000,8.2,1230000
36.0795613,-115.09,Eldorado Pumped Storage,United States,10330000,1000000,10.33,10330000
40.7561745,-76.12852989,Silver Creek Pumped Storage Project,United States,2400000,300000,8,2400000
27.3364347,-82.53,Sarasota County School District,United States,160000,20000,8,160000
39.9493923,-75.16618634,1500 Walnut,United States,1260,210,6,1260
33.64742835,-117.8466369,UCI Microgrid: Thermal Storage,United States,52720,6590,8,52720
43.0120545,-75.039989,ConEdison Interoperability of Demand Response Resources: Thermal,United States,10000,1000,10,10000
37.64219591,-122.1038385,CLPCCD - Utility Infrastructure Project,United States,4156.3,890,4.67,4156.3
40.7591232,-73.97955599,Rockefeller Center Thermal Storage,United States,15375,1025,15,15375
31.7639721,-106.49,EPCC Thermal Storage: Rio Grande,United States,1440,180,8,1440
33.9533487,-117.4,Riverside Public Utilities 5 MW Ice Energy Project,United States,30000,5000,6,30000
33.8347516,-117.911732,Anaheim Public Utility- Ice Energy,United States,950,200,4.75,950
37.831316,-122.29,Halotechnics Advanced Molten Glass for Heat Transfer and Thermal Energy Storage,United States,30,5,6,30
34.0522342,-118.24,Ice Energy procurement from SCE's November 2014 LCR: 25.6 MW,United States,153600,25600,6,153600
32.8776555,-117.2432723,UCSD Thermal Storage Tank,United States,16000,4000,4,16000
43.60842034,-72.98055836,Citizens Bank - Green Mountain Power Ice Energy Project 2,United States,60,10,6,60
33.9459413,-117.4102444,Riverside Public Utilities 5 MW Ice Energy Project,United States,30000,5000,6,30000
40.522734,-105.09,Fort Collins Utilities Four Cities Smart Grid Development Project - Facilities Site,United States,552,92,6,552
40.5729396,-105.08,Fort Collins Utilities Four Cities Smart Grid Development Project - CSU Site,United States,480,80,6,480
32.7762719,-96.7968559,CALMAC Centex Building,United States,1230,205,6,1230
40.58224158,-122.3719622,Park Marina Building,United States,792,132,6,792
42.1456895,-87.84653765,Underwriters Laboratories - Calmac,United States,17500,1250,14,17500
29.382539,-98.6135459,Lackland Air Force Base,United States,4640,580,8,4640
38.52245,-77.29,Federal Government Facility Chilled Water TES,United States,685,274,2.5,685
40.9682437,-76.60415398,Geisinger Health System Danville Chilled Water Thermal Storage,United States,5600,700,8,5600
26.640628,-81.8723084,Shell Point Retirement Village,United States,28800,4800,6,28800
40.5559815,-105.0758725,Ice Energy Manufacturing Facility Project,United States,144,24,6,144
33.04524735,-117.2672117,Encinitas Civic Center,United States,450,75,6,450
40.1421639,-74.23,Ice Energy Storage at Staples Retailer,United States,177.46,38,4.67,177.46
40.33355715,-80.04183976,Bethel Park High School,United States,2250,375,6,2250
38.7342564,-122.14,Cache Creek Casino,United States,7800,1300,6,7800
32.7801399,-96.8,Texas Instruments Manufacturing Plant,United States,51200,6400,8,51200
31.8855883,-106.44,EPCC Thermal Storage: Transmountain,United States,1800,225,8,1800
43.60858154,-72.98058334,Green Mountain Power Ice Energy Project 1,United States,210.15,45,4.67,210.15
36.114646,-115.17,Ice Energy Big Box Retailer Project,United States,177.46,38,4.67,177.46
34.072968,-114.81,Rice Solar Energy Project,United States,1200000,150000,8,1200000
39.9527237,-75.1635262,Power Station Generation Storage,United States,48000,6000,8,48000
40.5865396,-122.39,Redding Electric Utilities (Phase 2) - Ice Energy,United States,12000,6000,2,12000
34.05986265,-117.5092538,Ice Energy project at 10661 Business Dr.,United States,120,20,6,120
36.169202,-115.140597,Arrow Canyon Solar Project - 200 Megawatt Solar Photovoltaic Project,United States,1000,200,5,1000
